{
  "id": "550e8400-e29b-41d4-a716-446655440001",
  "title": "Apresentação do Bumba-meu-boi de Maracanã no Centro Histórico de São Luís",
  "description": "Registro da tradicional apresentação do sotaque de matraca do Bumba-meu-boi de Maracanã durante as festas juninas de 2024. A foto captura o momento em que os brincantes, vestidos com suas indumentárias características de veludo bordado e paetês, executam a toada 'Lua Brilhante'. O boi, ricamente ornamentado, é conduzido pelo miolo enquanto as matracas ecoam pelas ruas de paralelepípedo do centro histórico. Esta manifestação cultural, reconhecida como Patrimônio Cultural Imaterial da Humanidade pela UNESCO, representa a resistência e vitalidade das tradições afro-indígenas maranhenses.",
  "photographer": {
    "name": "Maria Silva Santos",
    "contact_email": "maria.santos@example.com",
    "profile_url": "https://portfolio.example.com/maria-santos",
    "community_affiliation": "Fotógrafa do Coletivo Cultural de São Luís"
  },
  "date_taken": "2024-06-24",
  "location": {
    "latitude": -2.5297,
    "longitude": -44.3028,
    "municipality": "São Luís",
    "state": "MA",
    "neighborhood": "Centro",
    "place_name": "Rua Portugal"
  },
  "tags": [
    "Bumba-meu-boi",
    "festas-juninas",
    "sotaque-de-matraca",
    "patrimonio-cultural",
    "centro-historico",
    "tradicao-popular",
    "maranhao",
    "sao-luis",
    "unesco",
    "cultura-afro-indigena"
  ],
  "manifestation": "Bumba-meu-boi",
  "license": {
    "type": "CC-BY-SA",
    "url": "https://creativecommons.org/licenses/by-sa/4.0/",
    "details": "Atribuição-CompartilhaIgual 4.0 Internacional"
  },
  "consent_provided": true,
  "technical": {
    "resolution": {
      "width": 4000,
      "height": 3000
    },
    "file_type": "jpeg",
    "file_size_bytes": 5242880,
    "camera": "Canon EOS R6",
    "iso": 800,
    "aperture": "f/2.8",
    "shutter_speed": "1/250"
  },
  "curation_status": "verified",
  "language": "pt-BR",
  "cultural_context": [
    {
      "role": "specialist",
      "name": "Dr. João Pedro Alcântara",
      "text": "O sotaque de matraca é uma das cinco variações do Bumba-meu-boi maranhense, caracterizado pelo uso intenso das matracas de madeira e pelo ritmo acelerado. O grupo de Maracanã é um dos mais tradicionais, mantendo suas características desde o início do século XX.",
      "date": "2024-07-15"
    }
  ],
  "checksum": "a1b2c3d4e5f6g7h8i9j0k1l2m3n4o5p6q7r8s9t0u1v2w3x4y5z6a7b8c9d0e1f2",
  "uploaded_at": "2024-07-20T14:32:00Z",
  "updated_at": "2024-07-21T09:15:00Z",
  "visibility": "public",
  "sensitive_content": false,
  "usage_notes": "Ao utilizar esta imagem, é importante contextualizar o Bumba-meu-boi como expressão cultural viva, evitando sua folclorização. Recomenda-se consultar membros da comunidade para projetos educacionais ou comerciais."
}
