{
  "id": "550e8400-e29b-41d4-a716-446655440003",
  "title": "Fachada de Sobrado Colonial com Azulejos Portugueses no Centro Histórico",
  "description": "Registro fotográfico de um sobrado colonial do século XIX no Centro Histórico de São Luís, tombado como Patrimônio Mundial pela UNESCO desde 1997. A fachada apresenta o característico revestimento de azulejos portugueses em tons de azul e branco, com padrões geométricos e florais típicos do período. Os azulejos, além de decorativos, serviam como proteção contra a umidade tropical. As janelas de guilhotina e os balcões de ferro trabalhado completam o conjunto arquitetônico que faz de São Luís a cidade com o maior conjunto de azulejos coloniais da América do Sul. A imagem documenta também o estado de conservação do imóvel e os esforços de preservação do patrimônio histórico.",
  "photographer": {
    "name": "Ana Paula Rodrigues",
    "profile_url": "https://instagram.com/arquitetura_slz",
    "community_affiliation": "Instituto do Patrimônio Histórico e Artístico do Maranhão"
  },
  "date_taken": "2024-05-18",
  "location": {
    "latitude": -2.531,
    "longitude": -44.3053,
    "municipality": "São Luís",
    "state": "MA",
    "neighborhood": "Centro",
    "place_name": "Rua da Estrela"
  },
  "tags": [
    "arquitetura-colonial",
    "azulejos-portugueses",
    "patrimonio-unesco",
    "centro-historico",
    "sobrado-colonial",
    "preservacao-historica",
    "arquitetura-luso-brasileira",
    "sao-luis",
    "seculo-xix",
    "patrimonio-mundial"
  ],
  "manifestation": "Arquitetura-Historica",
  "license": {
    "type": "CC-BY-NC-SA",
    "url": "https://creativecommons.org/licenses/by-nc-sa/4.0/",
    "details": "Atribuição-NãoComercial-CompartilhaIgual 4.0 Internacional"
  },
  "consent_provided": true,
  "technical": {
    "resolution": {
      "width": 5472,
      "height": 3648
    },
    "file_type": "jpeg",
    "file_size_bytes": 8388608,
    "camera": "Nikon D850",
    "iso": 200,
    "aperture": "f/8",
    "shutter_speed": "1/125"
  },
  "curation_status": "verified",
  "language": "pt-BR",
  "cultural_context": [
    {
      "role": "specialist",
      "name": "Arq. Marcos Vinicius Costa",
      "text": "O uso de azulejos em São Luís começou no século XVIII, mas teve seu auge no século XIX. Os padrões representam desde motivos religiosos até influências do art nouveau. Este exemplar mostra um padrão floral característico do final do período imperial, provavelmente importado diretamente do Porto, em Portugal.",
      "date": "2024-05-20"
    }
  ],
  "checksum": "c3d4e5f6g7h8i9j0k1l2m3n4o5p6q7r8s9t0u1v2w3x4y5z6a7b8c9d0e1f2g3h4",
  "uploaded_at": "2024-05-22T11:30:00Z",
  "updated_at": "2024-05-22T11:30:00Z",
  "visibility": "public",
  "sensitive_content": false,
  "usage_notes": "Imagem pode ser utilizada para fins educacionais, pesquisa histórica e promoção do patrimônio cultural. Para uso comercial, é necessário contatar o fotógrafo devido à licença NC (não-comercial)."
}
