{
  "id": "550e8400-e29b-41d4-a716-446655440002",
  "title": "Roda de Tambor de Crioula no Bairro da Madre Deus",
  "description": "Imagem capturada durante uma autêntica roda de Tambor de Crioula no tradicional bairro da Madre Deus, em São Luís. A foto documenta o momento da punga, quando duas dançadeiras se encontram no centro da roda. As mulheres vestem saias rodadas coloridas e blusas brancas, movimentando-se ao som dos tambores grandes, meião e crivador. O Tambor de Crioula é uma dança de origem afro-brasileira que celebra São Benedito e representa a ancestralidade e resistência da cultura negra no Maranhão. A manifestação foi reconhecida como Patrimônio Cultural do Brasil pelo IPHAN em 2007.",
  "photographer": {
    "name": "Carlos Eduardo Ferreira",
    "contact_email": "carlos.ferreira@example.com",
    "community_affiliation": "Grupo Cultural Raízes da Madre Deus"
  },
  "date_taken": "2024-08-13",
  "location": {
    "latitude": -2.5142,
    "longitude": -44.2835,
    "municipality": "São Luís",
    "state": "MA",
    "neighborhood": "Madre Deus",
    "place_name": "Terreiro Comunitário"
  },
  "tags": [
    "Tambor-de-Crioula",
    "danca-afro-brasileira",
    "cultura-negra",
    "punga",
    "patrimonio-cultural",
    "sao-benedito",
    "madre-deus",
    "tradicao-popular",
    "resistencia-cultural",
    "iphan"
  ],
  "manifestation": "Tambor-de-Crioula",
  "license": {
    "type": "CC-BY",
    "url": "https://creativecommons.org/licenses/by/4.0/",
    "details": "Atribuição 4.0 Internacional - Uso livre com crédito ao autor"
  },
  "consent_provided": true,
  "technical": {
    "resolution": {
      "width": 3840,
      "height": 2560
    },
    "file_type": "jpeg",
    "file_size_bytes": 4718592,
    "camera": "Sony A7 III",
    "iso": 1600,
    "aperture": "f/1.8",
    "shutter_speed": "1/200"
  },
  "curation_status": "verified",
  "language": "pt-BR",
  "cultural_context": [
    {
      "role": "community-leader",
      "name": "Mestra Zezé do Tambor",
      "text": "O Tambor de Crioula é mais que uma dança, é nosso jeito de honrar os ancestrais e manter viva nossa história. A punga representa o encontro de energias, o respeito entre as mulheres e a celebração da vida. Cada toque de tambor carrega a memória de quem veio antes de nós.",
      "date": "2024-08-14"
    }
  ],
  "checksum": "b2c3d4e5f6g7h8i9j0k1l2m3n4o5p6q7r8s9t0u1v2w3x4y5z6a7b8c9d0e1f2g3",
  "uploaded_at": "2024-08-15T16:45:00Z",
  "updated_at": "2024-08-16T10:20:00Z",
  "visibility": "public",
  "sensitive_content": false,
  "usage_notes": "Esta é uma manifestação sagrada para muitas comunidades. Ao usar esta imagem, ressalte o caráter religioso e de resistência cultural do Tambor de Crioula. Para projetos comerciais, recomenda-se diálogo com a comunidade."
}
